COD_DEP,DEPENDENCIA,SUPERINTENDENCIA,DIRECCION,PROVINCIA,LATITUD,LONGITUD,PERSONAL,MOVILES,ARMAS
1535,DIRECCION GENERAL DE SECRETARIA GENERAL,PLANEAMIENTO Y DESARROLLO ESTRATEGICO,MORENO 1550 (CDAD.AUTONOMA DE BUENOS AIRES),CABA,-34.61273058582,-58.38784726,100,100,100
1536,UNIDAD DE INTELIGENCIA CRIMINAL (BS.AS),AGENCIAS FEDERALES,MORENO 1417 (CDAD.AUTONOMA DE BUENOS AIRES),CABA,-34.6120872523528,-58.3865069400827,100,100,100
1537,OFICINA ENLACE INTERPOL Y CONVENIO POLICIAL ARGENTINO (BUENOS AIRES),AGENCIAS FEDERALES,MORENO 1417 (CDAD.AUTONOMA DE BUENOS AIRES),CABA,-34.6121306875482,-58.3864667125144,100,100,100
1538,COORDINACION OPERATIVA CUARTELES-S.F.B (BUENOS AIRES),AGENCIAS FEDERALES,MORENO 1417 (CDAD.AUTONOMA DE BUENOS AIRES),CABA,-34.612029237476,-58.3864600694297,100,100,100
1539,COORDINACION OPERATIVA GABINETE CIENTIFICO-S.F.P.C (BUENOS AIRES),AGENCIAS FEDERALES,MORENO 1417 (CDAD.AUTONOMA DE BUENOS AIRES),CABA,-34.6119320396858,-58.3864630219118,100,100,100
1540,COORDINACION OPERATIVA UNIDADES ANTIDROGAS-S.D.P (BUENOS AIRES),AGENCIAS FEDERALES,MORENO 1417 (CDAD.AUTONOMA DE BUENOS AIRES),CABA,-34.612065686618,-58.3864615456707,100,100,100
1541,COORDINACION OPERATIVA CON LAS UNIDADES TACTICAS DE INTERVENCION FEDERAL.-S.F.I.T (BS.AS),AGENCIAS FEDERALES,MORENO 1417 (CDAD.AUTONOMA DE BUENOS AIRES),CABA,-34.612083911183,-58.3864179965601,100,100,100
1542,UNIDAD DE INTELIGENCIA CRIMINAL (SANTA FE),AGENCIAS FEDERALES,SAN MARTIN 3381 (SANTA FE),SANTA FE,-31.6369994070077,-60.7038216914975,100,100,100
1543,OFICINA ENLACE INTERPOL Y CONVENIO POLICIAL ARGENTINO SANTA FE,AGENCIAS FEDERALES,SAN MARTIN 3381 (SANTA FE),SANTA FE,-31.637059960392,-60.7038054347829,100,100,100
1545,COORDINACION OPERATIVA GABINETES CIENTIFICOS-S.F.P.C SANTA FE,AGENCIAS FEDERALES,SAN MARTIN 3381 (SANTA FE),SANTA FE,-31.6370314138015,-60.7037734293759,100,100,100
1547,COORDINANCION OPERATIVA CON LAS UNIDADES TACTICAS DE INTERVENCION FEDERAL-S.F.I.T SANTA FE,AGENCIAS FEDERALES,SAN MARTIN 3381 (SANTA FE),SANTA FE,-31.6370089225421,-60.7037774935546,100,100,100
1548,UNIDAD DE INTELIGENCIA CRIMINAL MAR DEL PLATA,AGENCIAS FEDERALES,SARMIENTO 2551 (GENERAL PUEYRREDON),BUENOS AIRES,-38.011231668543,-57.5425617547744,100,100,100
1551,COORDINACION OPERATIVA GABINETE CIENTIFICOS-S.F.P.C MAR DEL PLATA,AGENCIAS FEDERALES,ESCOLLERA NORTE S/N (GENERAL PUEYRREDON),BUENOS AIRES,-38.035131746249,-57.5264075566957,100,100,100
1552,COORDINACION OPERATIVA UNIDADES ANTIDROGAS-S.D.P MAR DEL PLATA,AGENCIAS FEDERALES,SARMIENTO 2551 (GENERAL PUEYRREDON),BUENOS AIRES,-38.011231868543,-57.5425617547744,100,100,100
1553,COORDINACION OPERATIVA CON LAS UNIDADES TACTICAS DE INTERVENCION FEDERAL-S.F.I.T MAR DEL PLATA,AGENCIAS FEDERALES,SARMIENTO 2551 (GENERAL PUEYRREDON),BUENOS AIRES,-38.011231968543,-57.5425617547744,100,100,100
1554,UNIDAD DE INTELIGENCIA CRIMINAL (PATAGONIA-NEUQUEN),AGENCIAS FEDERALES,SANTIAGO DEL ESTERO 136 (CONFLUENCIA),NEUQUEN,-38.9535320322,-68.0652723803005,100,100,100
1555,OFICINA ENLACE INTERPOL Y CONVENIO POLICIAL ARGENTINO (PATAGONIA-NEUQUEN),AGENCIAS FEDERALES,SANTIAGO DEL ESTERO 136 (CONFLUENCIA),NEUQUEN,-38.9535321322,-68.0652723803005,100,100,100
1556,COORDINACION OPERATIVA CUARTELES-S.F.B (PATAGONIA-NEUQUEN),AGENCIAS FEDERALES,SANTIAGO DEL ESTERO 136 (CONFLUENCIA),NEUQUEN,-38.9535322322,-68.0652723803005,100,100,100
1557,COORDINACION OPERATIVA GABINETES CIENTIFICOS-S.F.P.C (PATAGONIA-NEUQUEN),AGENCIAS FEDERALES,SANTIAGO DEL ESTERO 136 (CONFLUENCIA),NEUQUEN,-38.9535323322,-68.0652723803005,100,100,100
156,DIVISION ARMAMENTO Y MUNICION,ADMINISTRACION,CAMILO TORRES Y TENORIO 2155 (CDAD.AUTONOMA DE BUENOS AIRES),CABA,-34.645432416767,-58.4398221617106,100,100,100
1560,UNIDAD DE INTELIGENCIA CRIMINAL (PATAG.SUR-COMOD.RIVADAVIA),AGENCIAS FEDERALES,AV. RIVADAVIA 1183,CHUBUT,-45.8620139139664,-67.4919659026598,100,100,100
1561,OFICINA ENLACE INTERPOL Y CONVENIO POLICIAL ARGENTINO (PATAG.SUR-COMOD.RIVADAVIA),AGENCIAS FEDERALES,AV. RIVADAVIA 1183,CHUBUT,-45.8620139139664,-67.4919659026598,100,100,100
1562,COORDINACION OPERATIVA CUARTELES - S.F.B. (PATAG.SUR-COMOD.RIVADAVIA),AGENCIAS FEDERALES,AV. RIVADAVIA 1183,CHUBUT,-45.8620139139664,-67.4919659026598,100,100,100
1563,COORDINACION OPERATIVA GABINETES CIENTIFICOS - S.F.P.C. (PATAG.SUR-COMOD.RIVADAVIA),AGENCIAS FEDERALES,AV. RIVADAVIA 1183,CHUBUT,-45.8620139139664,-67.4919659026598,100,100,100
1564,COORDINACION OPERATIVA UNIDADES ANTIDROGAS - S.D.P. (PATAG.SUR-COMOD.RIVADAVIA),AGENCIAS FEDERALES,AV. RIVADAVIA 1183,CHUBUT,-45.8620139139664,-67.4919659026598,100,100,100
1565,COORDINACION OPERATIVA CON LAS UNIDADES TACTICAS DE INTERVENCION FEDERAL-S.F.I.T.(PATAG.SUR-COMOD R),AGENCIAS FEDERALES,AV. RIVADAVIA 1183,CHUBUT,-45.8620139139664,-67.4919659026598,100,100,100
1566,UNIDAD DE INTELIGENCIA CRIMINAL (NOA-TUCUMAN),AGENCIAS FEDERALES,LAPRIDA 1074 (SAN MIGUEL DE TUCUMAN),TUCUMAN,-26.816833107118,-65.1995920653061,100,100,100
1567,OFICINA ENLACE INTERPOL Y CONVENIO POLICIAL ARGENTINO (NOA-TUCUMAN),AGENCIAS FEDERALES,LAPRIDA 1074 (SAN MIGUEL DE TUCUMAN),TUCUMAN,-26.816833207118,-65.1995920653061,100,100,100
1568,COORDINACION OPERATIVA CUARTELES-S.F.B. (NOA-TUCUMAN),AGENCIAS FEDERALES,LAPRIDA 1074 (SAN MIGUEL DE TUCUMAN),TUCUMAN,-26.816833307118,-65.1995920653061,100,100,100
1569,COORDINACION OPERATIVA GABINETES CIENTIFICOS - S.F.P.C. (NOA-TUCUMAN),AGENCIAS FEDERALES,LAPRIDA 1074 (SAN MIGUEL DE TUCUMAN),TUCUMAN,-26.816833407118,-65.1995920653061,100,100,100
157,DIVISION SERVICIOS MOTORIZADOS,FEDERAL DE INTERVENCION TERRITORIAL,VELEZ SARSFIELD 1981 (CDAD.AUTONOMA DE BUENOS AIRES),CABA,-34.6587017630978,-58.3888044139767,100,100,100
1570,COORDINACION OPERATIVA UNIDADES ANTIDROGAS - S.D.P. (NOA-TUCUMAN),AGENCIAS FEDERALES,LAPRIDA 1074 (SAN MIGUEL DE TUCUMAN),TUCUMAN,-26.816833607118,-65.1995920653061,100,100,100
1571,COORDINACION OPERATIVA CON LAS UNIDADES TACTICAS DE INTERVENCION FEDERAL - S.F.I.T. (NOA-TUCUMAN),AGENCIAS FEDERALES,LAPRIDA 1074 (SAN MIGUEL DE TUCUMAN),TUCUMAN,-26.816833707118,-65.1995920653061,100,100,100
1572,UNIDAD DE INTELIGENCIA CRIMINAL (CUYO),AGENCIAS FEDERALES,AV. RIVADAVIA 44 (CAPITAL),SAN JUAN,-31.536633858417,-68.5253560205081,100,100,100
1573,OFICINA ENLACE INTERPOL Y CONVENIO POLICIAL ARGENTINO (CUYO),AGENCIAS FEDERALES,AV. RIVADAVIA 44 (CAPITAL),SAN JUAN,-31.536633958417,-68.5253560205081,100,100,100
1574,COORDINACION OPERATIVA CUARTELES - S.F.B. (CUYO),AGENCIAS FEDERALES,AV. RIVADAVIA 44 (CAPITAL),SAN JUAN,-31.536634058417,-68.5253560205081,100,100,100
1575,COORDINACION OPERATIVA GABINETES CIENTIFICOS - S.F.P.C. (CUYO),AGENCIAS FEDERALES,AV. RIVADAVIA 44 (CAPITAL),SAN JUAN,-31.536634158417,-68.5253560205081,100,100,100
1576,COORDINACION OPERATIVA UNIDADES ANTIDROGAS - S.D.P. (CUYO),AGENCIAS FEDERALES,AV. RIVADAVIA 44 (CAPITAL),SAN JUAN,-31.536634258417,-68.5253560205081,100,100,100
1577,COORDINACION OPERATIVA CON LAS UNIDADES TACTICAS DE INTERVENCION FEDERAL - S.F.I.T. (CUYO),AGENCIAS FEDERALES,AV. RIVADAVIA 44 (CAPITAL),SAN JUAN,-31.536634358417,-68.5253560205081,100,100,100
1578,UNIDAD DE INTELIGENCIA CRIMINAL (NEA-CORRIENTES),AGENCIAS FEDERALES,PLACIDO MARTINEZ 750 (CAPITAL),CORRIENTES,-27.46163441932,-58.84073789,100,100,100
1579,OFICINA ENLACE INTERPOL Y CONVENIO POLICIAL ARGENTINO (NEA-CORRIENTES),AGENCIAS FEDERALES,PLACIDO MARTINEZ 750 (CAPITAL),CORRIENTES,-27.46163451932,-58.84073789,100,100,100
158,DIVISION GRUPO DE OPERACIONES MOTORIZADAS FEDERALES (G.O.M.F),FEDERAL DE INTERVENCION TERRITORIAL,CASTRO 1277 (CDAD.AUTONOMA DE BUENOS AIRES),CABA,-34.62803463976,-58.4199789245984,100,100,100
1580,COORDINACION OPERATIVA CUARTELES - S.F.B. (NEA-CORRIENTES),AGENCIAS FEDERALES,PLACIDO MARTINEZ 750 (CAPITAL),CORRIENTES,-27.46163471932,-58.84073789,100,100,100
1581,COORDINACION OPERATIVA GABINETES CIENTIFICOS - S.F.P.C. (NEA-CORRIENTES),AGENCIAS FEDERALES,PLACIDO MARTINEZ 750 (CAPITAL),CORRIENTES,-27.46163481932,-58.84073789,100,100,100
1582,COORDINACION OPERATIVA UNIDADES ANTIDROGAS - S.D.P. (NEA-CORRIENTES),AGENCIAS FEDERALES,PLACIDO MARTINEZ 750 (CAPITAL),CORRIENTES,-27.46163491932,-58.84073789,100,100,100
1583,COORDINACION OPERATIVA CON LAS UNIDADES TACTICAS DE INTERVENCION FEDERAL - S.F.I.T. (NEA-CORRIENTES),AGENCIAS FEDERALES,PLACIDO MARTINEZ 750 (CAPITAL),CORRIENTES,-27.46163501932,-58.84073789,100,100,100
1584,UNIDAD DE INTELIGENCIA CRIMINAL CORDOBA,AGENCIAS FEDERALES,YRIGOYEN HIPOLITO 493 (CORDOBA),CORDOBA,-31.4264766354018,-64.1855928848198,100,100,100
1585,OFICINA ENLACE INTERPOL Y CONVENIO POLICIAL ARGENTINO CDBA,AGENCIAS FEDERALES,YRIGOYEN HIPOLITO 493 (CORDOBA),CORDOBA,-31.4264770689023,-64.1855624034799,100,100,100
1586,COORDINACION OPERATIVA CUARTELES - S-F-B CDBA,AGENCIAS FEDERALES,YRIGOYEN HIPOLITO 493 (CORDOBA),CORDOBA,-31.4264397878513,-64.1855542751225,100,100,100
1587,COORDINACION OPERATIVA GABINETES CIENTIFICOS - S.F.P.C. CDBA,AGENCIAS FEDERALES,YRIGOYEN HIPOLITO 493 (CORDOBA),CORDOBA,-31.4264597288804,-64.1855979650432,100,100,100
1588,COORDINACION OPERATIVA UNIDADES ANTIDROGAS S.D.P. CDBA,AGENCIAS FEDERALES,YRIGOYEN HIPOLITO 493 (CORDOBA),CORDOBA,-31.4264432558566,-64.1856035532888,100,100,100
1589,COORDINACION OPERATIVA CON LAS UNIDADES TACTICAS DE INTERVENCION FEDERAL S.F.I.T. CDBA,AGENCIAS FEDERALES,YRIGOYEN HIPOLITO 493 (CORDOBA),CORDOBA,-31.4263699942159,-64.1856426710085,100,100,100
159,SECCION LOGISTICA - C.G.I,FEDERAL DE INTERVENCION TERRITORIAL,CAVIA 3302 (CDAD.AUTONOMA DE BUENOS AIRES),CABA,-34.574101818417,-58.4048386692502,100,100,100
1590,SECCION ESTACION FERROAUTOMOTOR MAR DEL PLATA,FEDERAL DE TRANSPORTE,AV. PEDRO LURO 4601 (GENERAL PUEYRREDON),BUENOS AIRES,-37.9882358779,-57.5664541,100,100,100
1591,DIVISION CENTRO FEDERAL DE DATOS,FEDERAL DE TECNOLOGIAS DE LA INFORMACION Y COMUNICACIONES,CEVALLOS VIRREY 362 (CDAD.AUTONOMA DE BUENOS AIRES),CABA,-34.6131328800273,-58.3888394009256,100,100,100
1592,DIVISION UNIDAD OPERATIVA FEDERAL GENERAL DEHEZA,AGENCIAS FEDERALES,BERUTTI 306 (GENERAL DEHEZA),CORDOBA,-32.755336092121,-63.7841452378505,100,100,100
1594,CENTRO ESTRATEGICO DE CONTROL OPERACIONAL,SEGURIDAD Y CUSTODIA,CAVIA 3350 (CDAD.AUTONOMA DE BUENOS AIRES),CABA,-34.5736752409,-58.40563208,100,100,100
1595,EX - UNIDAD DE APOYO JUDICIAL,SEGURIDAD Y CUSTODIA,MORENO 1417 (CDAD.AUTONOMA DE BUENOS AIRES),CABA,-34.6119411519835,-58.3865065710224,100,100,100
1596,"SECCION SEGURIDAD Y CUSTODIA CAJA DE RETIROS, JUBILACIONES Y PENSIONES DE LA P.F.A",SEGURIDAD Y CUSTODIA,BALCARCE 50 (CDAD.AUTONOMA DE BUENOS AIRES),CABA,-34.6133363533,-58.38842041,100,100,100
1597,SECCION SEGURIDAD Y CUSTODIA MUSEO SITIO DE MEMORIA,SEGURIDAD Y CUSTODIA,AV. DEL LIBERTADOR 8151 (CDAD.AUTONOMA DE BUENOS AIRES),CABA,-34.53873643263,-58.46435466,100,100,100
1598,CENTRO DE ENTRENAMIENTO Y CONTRALOR,SEGURIDAD Y CUSTODIA,MORENO 1417 (CDAD.AUTONOMA DE BUENOS AIRES),CABA,-34.6119599840621,-58.3864644981528,100,100,100
1599,UNIDAD DE SEGURIDAD Y CUSTODIA EN ESPECTACULOS DEPORTIVOS,SEGURIDAD Y CUSTODIA,MORENO 1417 (CDAD.AUTONOMA DE BUENOS AIRES),CABA,-34.6119211049273,-58.3864253777653,100,100,100
16,DEPTO. INFORMACION CRIMINAL,INTELIGENCIA CRIMINAL,MORENO 1550 (CDAD.AUTONOMA DE BUENOS AIRES),CABA,-34.61333679617,-58.38834889,100,100,100
160,DIR. GRAL. ORDEN URBANO Y FEDERAL,FEDERAL DE INTERVENCION TERRITORIAL,CAVIA 3302 (CDAD.AUTONOMA DE BUENOS AIRES),CABA,-34.5741435344362,-58.4048834919107,100,100,100
1600,GABINETE CIENTIFICO-SAN CARLOS DE BARILOCHE,FEDERAL DE POLICIA CIENTIFICA,GRL.TISCORNIA 6 (BARILOCHE),RIO NEGRO,-41.137636997519,-71.3103648057216,100,100,100
1601,DIVISION SEGURIDAD INFORMATICA,FEDERAL DE TECNOLOGIAS DE LA INFORMACION Y COMUNICACIONES,MORENO 1550 (CDAD.AUTONOMA DE BUENOS AIRES),CABA,-34.61333709826,-58.38855231,100,100,100
1603,DIVISION DESARROLLO DE APLICATIVOS INSTITUCIONALES,FEDERAL DE TECNOLOGIAS DE LA INFORMACION Y COMUNICACIONES,CEVALLOS VIRREY 362 (CDAD.AUTONOMA DE BUENOS AIRES),CABA,-34.61343711248,-58.3887076,100,100,100
1604,DIVISION REQUERIMIENTOS JUDICIALES DE IMAGENES Y ANALISIS INVESTIGATIVO,FEDERAL DE TECNOLOGIAS DE LA INFORMACION Y COMUNICACIONES,AV. BELGRANO 1549 (CDAD.AUTONOMA DE BUENOS AIRES),CABA,-34.613437264242,-58.3882061755102,100,100,100
1605,DIVISION COORDINACION Y ENLACE C.A.E.C.O.PAZ,FEDERAL DE INTERVENCION TERRITORIAL,CAVIA 3380 (CDAD.AUTONOMA DE BUENOS AIRES),CABA,-34.5738012324473,-58.4042036603986,100,100,100
1606,SECCION SEGURIDAD BANCO CENTRAL DE LA REPUBLICA ARGENTINA,SEGURIDAD Y CUSTODIA,BALCARCE 186 (CDAD.AUTONOMA DE BUENOS AIRES),CABA,-34.609837439514,-58.3705819142857,100,100,100
1607,DIVISION ARQUITECTURA Y CONTRALOR TECNICO BANCARIO,ADMINISTRACION,AV. BELGRANO 752 (CDAD.AUTONOMA DE BUENOS AIRES),CABA,-34.6129201395575,-58.3769365615633,100,100,100
1608,DIVISION TALLERES,ADMINISTRACION,AV. BELGRANO 752 (CDAD.AUTONOMA DE BUENOS AIRES),CABA,-34.6129132407984,-58.3770041285336,100,100,100
1609,SECCION COMBUSTIBLE,ADMINISTRACION,AV. BELGRANO 3144 (CDAD.AUTONOMA DE BUENOS AIRES),CABA,-34.61543770949,-58.41030754,100,100,100
161,SECCION ADMINISTRACION,INTELIGENCIA CRIMINAL,AV. CASEROS 915 (CDAD.AUTONOMA DE BUENOS AIRES),CABA,-34.6278590951167,-58.3768936845392,100,100,100
1610,UNIDAD DE PERSONAL DOCENTE (UPD),INSTRUCCION Y FORMACION ACADEMICA,ROSARIO 532 (CDAD.AUTONOMA DE BUENOS AIRES),CABA,-34.6196901574817,-58.4360465417858,100,100,100
1611,SECCION ESTACION INGENIERO WHITE,FEDERAL DE TRANSPORTE,SALTA 1929 (CDAD.AUTONOMA DE BUENOS AIRES),CABA,-34.6301153497556,-58.3828338785878,100,100,100
1612,SECCION ALCAIDIA - SFT,FEDERAL DE TRANSPORTE,HORNOS GRAL. 41 (CDAD.AUTONOMA DE BUENOS AIRES),CABA,-34.6283852756449,-58.3804507873922,100,100,100
1614,DIVISION ESTADISTICA CRIMINAL,INTELIGENCIA CRIMINAL,AV. BELGRANO 1549 (CDAD.AUTONOMA DE BUENOS AIRES),CABA,-34.613438364242,-58.3882061755102,100,100,100
1615,DIVISION ANALISIS DEL CRIMER COMPLEJO,INTELIGENCIA CRIMINAL,AV. BELGRANO 1549 (CDAD.AUTONOMA DE BUENOS AIRES),CABA,-34.613438464242,-58.3882061755102,100,100,100
1616,SECCION ASESORIA LEGAL Y SISTEMAS,INTELIGENCIA CRIMINAL,AV. CASEROS 915 (CDAD.AUTONOMA DE BUENOS AIRES),CABA,-34.6278357594222,-58.3769339363675,100,100,100
1617,DIVISION CENTRO,ASUNTOS INTERNOS E INSPECTORIA GENERAL,AV. RIVADAVIA 1325 (CDAD.AUTONOMA DE BUENOS AIRES),CABA,-34.6085373354725,-58.3853357273476,100,100,100
1618,DEPTO. INVESTIGACIONES FEDERALES CAMPANA,AGENCIAS FEDERALES,AV. LAS HERAS GRAL. 468 (CAMPANA),BUENOS AIRES,-34.164938734151,-58.9693587684009,100,100,100
1619,SECCION AUTOMOTORES,AGENCIAS FEDERALES,VENEZUELA 3143 (CDAD.AUTONOMA DE BUENOS AIRES),CABA,-34.6164516135419,-58.4101778988458,100,100,100
162,DEPTO. CUERPO GUARDIA DE INFANTERIA,FEDERAL DE INTERVENCION TERRITORIAL,MORENO 1550 (CDAD.AUTONOMA DE BUENOS AIRES),CABA,-34.6128107643217,-58.3878318664159,100,100,100
1620,DEPTO. ANTISECUESTROS NORTE,INVESTIGACIONES FEDERALES,CAVIA 3350 (CDAD.AUTONOMA DE BUENOS AIRES),CABA,-34.5742055333933,-58.4047462304492,100,100,100
1621,DEPTO. ANTISECUESTROS SUR,INVESTIGACIONES FEDERALES,CAVIA 3350 (CDAD.AUTONOMA DE BUENOS AIRES),CABA,-34.5741678949088,-58.4047238826072,100,100,100
1622,DEPTO. INVESTIGACIONES COMPLEJAS NEA,INVESTIGACIONES FEDERALES,BOLIVAR 1990 (CHAJARI),ENTRE RIOS,-30.753239238762,-57.9876786725884,100,100,100
1623,SECCION OPERACIONES NEA,INVESTIGACIONES FEDERALES,MORENO 1417 (CDAD.AUTONOMA DE BUENOS AIRES),CABA,-34.612226670137,-58.3864549025861,100,100,100
1624,DIVISION DELITOS CONSTITUCIONALES,INVESTIGACIONES FEDERALES,MORENO 1417 (CDAD.AUTONOMA DE BUENOS AIRES),CABA,-34.6120571818196,-58.3865205953123,100,100,100
1625,DIVISION AGENCIAS Y SERVICIOS DE VIGILANCIA PRIVADA,INVESTIGACIONES FEDERALES,MORENO 1417 (CDAD.AUTONOMA DE BUENOS AIRES),CABA,-34.612197207139,-58.3864036032099,100,100,100
1626,DIVISION DENUNCIAS DE DELITOS FEDERALES,INVESTIGACIONES FEDERALES,MORENO 1550 (CDAD.AUTONOMA DE BUENOS AIRES),CABA,-34.61293968415,-58.38811293,100,100,100
1627,DEPTO. SEGURIDAD Y DETENIDOS,INVESTIGACIONES FEDERALES,MORENO 1550 (CDAD.AUTONOMA DE BUENOS AIRES),CABA,-34.6957121529947,-58.4715619997865,100,100,100
1628,DIVISION ALCAIDIAS,INVESTIGACIONES FEDERALES,MADARIAGA 6976 (CDAD.AUTONOMA DE BUENOS AIRES),CABA,-34.6956452252606,-58.4716427823082,100,100,100
1629,DEPTO. INVESTIGACIONES NACIONALES,INVESTIGACIONES FEDERALES,MORENO 1550 (CDAD.AUTONOMA DE BUENOS AIRES),CABA,-34.69576539,-58.4724133,100,100,100
1630,DEPTO. TECNICO DEL CIBERCRIMEN,INVESTIGACIONES FEDERALES,CAVIA 3302 (CDAD.AUTONOMA DE BUENOS AIRES),CABA,-34.5735687088507,-58.4056877602703,100,100,100
1631,SECCION ADUANA,INVESTIGACIONES FEDERALES,MORENO 1417 (CDAD.AUTONOMA DE BUENOS AIRES),CABA,-34.6119830685399,-58.3864600694297,100,100,100
1632,DEPTO. ARTICULACION OPERATIVA,INVESTIGACIONES FEDERALES,MADARIAGA 6976 (CDAD.AUTONOMA DE BUENOS AIRES),CABA,-34.6960531765063,-58.4719489801606,100,100,100
1633,DIVISION SERVICIOS DESCENTRALIZADOS INTERIOR II,BIENESTAR,USPALLATA 3400 (CDAD.AUTONOMA DE BUENOS AIRES),CABA,-34.64084032933,-58.41099004,100,100,100
1634,COORDINACION TECNICO ADMINISTRATIVA,AVIACION FEDERAL,LAVAISSE BENJAMIN 1551 (CDAD.AUTONOMA DE BUENOS AIRES),CABA,-34.62774042139,-58.35194717,100,100,100
1635,UNIDAD DE ANALISIS Y CONTROL ADMINISTRATIVO,ADMINISTRACION,AV. DE MAYO 1333 (CDAD.AUTONOMA DE BUENOS AIRES),CABA,-34.6089528722195,-58.3853438466733,100,100,100
1636,DEPTO. PRESUPUESTO,ADMINISTRACION,AV. RIVADAVIA 1330 (CDAD.AUTONOMA DE BUENOS AIRES),CABA,-34.608740677114,-58.3853356290184,100,100,100
1637,SECCION REGISTRO DE BIENES DE CONSUMO E INMUEBLES,ADMINISTRACION,AV. RIVADAVIA 1330 (CDAD.AUTONOMA DE BUENOS AIRES),CABA,-34.6087318907654,-58.3852960533697,100,100,100
164,DIVISION OPERACIONES - CGI,FEDERAL DE INTERVENCION TERRITORIAL,MORENO 1550 (CDAD.AUTONOMA DE BUENOS AIRES),CABA,-34.61302823,-58.38781598,100,100,100
165,DIVISION OPERACIONES - C.P.M,FEDERAL DE INTERVENCION TERRITORIAL,CAVIA 3302 (CDAD.AUTONOMA DE BUENOS AIRES),CABA,-34.5741085097097,-58.4049524400823,100,100,100
166,SECCION LOGISTICA - C.P.MOTO,FEDERAL DE INTERVENCION TERRITORIAL,CAVIA 3302 (CDAD.AUTONOMA DE BUENOS AIRES),CABA,-34.5741227287049,-58.4048031158652,100,100,100
170,DEPTO. CUERPO POLICIA MONTADA,FEDERAL DE INTERVENCION TERRITORIAL,CAVIA 3302 (CDAD.AUTONOMA DE BUENOS AIRES),CABA,-34.5746145371597,-58.406139923142,100,100,100
171,DIVISION ASUNTOS MIGRATORIOS,INVESTIGACIONES FEDERALES,MORENO 1417 (CDAD.AUTONOMA DE BUENOS AIRES),CABA,-34.6119630214938,-58.3864231634037,100,100,100
173,DEPTO. GRUPOS ESPECIALES G.E.-1,FEDERAL DE INTERVENCION TERRITORIAL,MORENO 1550 (CDAD.AUTONOMA DE BUENOS AIRES),CABA,-34.6129840478434,-58.3879263458425,100,100,100
1745,DEPTO. ÁREA PODER LEGISLATIVO,SEGURIDAD Y CUSTODIA,CAVIA 3302 (CDAD.AUTONOMA DE BUENOS AIRES),CABA,-34.5740795489546,-58.4050079287582,100,100,100
175,CURSO PREPARATORIO AGENTES,INSTRUCCION Y FORMACION ACADEMICA,AV. PUNTA ARENAS 1201 (CDAD.AUTONOMA DE BUENOS AIRES),CABA,-34.590741577718,-58.4702827186772,100,100,100
178,SECCION BATALLON I,FEDERAL DE INTERVENCION TERRITORIAL,CAVIA 3302 (CDAD.AUTONOMA DE BUENOS AIRES),CABA,-34.5741259697991,-58.4049200611067,100,100,100
179,SECCION BATALLON II,FEDERAL DE INTERVENCION TERRITORIAL,CEVALLOS VIRREY 360 (CDAD.AUTONOMA DE BUENOS AIRES),CABA,-34.6131466242104,-58.3888381092147,100,100,100
180,SECCION BATALLON III,FEDERAL DE INTERVENCION TERRITORIAL,CEVALLOS VIRREY 360 (CDAD.AUTONOMA DE BUENOS AIRES),CABA,-34.6131398660212,-58.3888392163955,100,100,100
181,DEPTO. GRUPOS ESPECIALES DE OPERACIONES FEDERALES (G.E.O.F),FEDERAL DE INTERVENCION TERRITORIAL,CAVIA 3302 (CDAD.AUTONOMA DE BUENOS AIRES),CABA,-34.5740923042343,-58.404981771625,100,100,100
182,SECCION LOGISTICA - C.P.M,FEDERAL DE INTERVENCION TERRITORIAL,CAVIA 3302 (CDAD.AUTONOMA DE BUENOS AIRES),CABA,-34.5740195363831,-58.4051082400945,100,100,100
184,SECCION IA.AGRUPACION,FEDERAL DE INTERVENCION TERRITORIAL,CAVIA 3302 (CDAD.AUTONOMA DE BUENOS AIRES),CABA,-34.57384217616,-58.40427361,100,100,100
185,SECCION IIA.AGRUPACION,FEDERAL DE INTERVENCION TERRITORIAL,CAVIA 3302 (CDAD.AUTONOMA DE BUENOS AIRES),CABA,-34.57384227616,-58.40427361,100,100,100
186,SECCION IIIA.AGRUPACION,FEDERAL DE INTERVENCION TERRITORIAL,CAVIA 3302 (CDAD.AUTONOMA DE BUENOS AIRES),CABA,-34.57384237616,-58.40427361,100,100,100
187,SECCION IV A. AGRUPACION,FEDERAL DE INTERVENCION TERRITORIAL,CAVIA 3302 (CDAD.AUTONOMA DE BUENOS AIRES),CABA,-34.57384247616,-58.40427361,100,100,100
189,DIVISION SEGURIDAD Y CUSTODIA CONSEJO DE LA MAGISTRATURA DE LA NACION,SEGURIDAD Y CUSTODIA,PARANA 386 (CDAD.AUTONOMA DE BUENOS AIRES),CABA,-34.604442543657,-58.3878756850057,100,100,100
200,SUPER. FEDERAL DE TRANSPORTE,FEDERAL DE TRANSPORTE,SALTA 1929 (CDAD.AUTONOMA DE BUENOS AIRES),CABA,-34.6301509796192,-58.3828710810352,100,100,100
266,DIVISION GESTION ADMINISTRATIVA (COORD.INTERNACIONAL),COOPERACION POLICIAL INTERNACIONAL,CAVIA 3350 (CDAD.AUTONOMA DE BUENOS AIRES),CABA,-34.573887801318,-58.4043672059696,100,100,100
268,DIVISION MANTENIMIENTO AERONAUTICO AVIONES,AVIACION FEDERAL,AVIADOR MATIENZO S/N 0 (EZEIZA),BUENOS AIRES,-34.7980169542131,-58.5264523603921,100,100,100
269,"DIVISION SEGURIDAD Y CUSTODIA MINIST. DE RELACIONES EXTERIORES, COMERCIO INTERNACIONAL Y CULTO",SEGURIDAD Y CUSTODIA,ESMERALDA 1212 (CDAD.AUTONOMA DE BUENOS AIRES),CABA,-34.59394294317,-58.3788614658098,100,100,100
270,DIVISION GESTION ADMINISTRATIVA - DGAJ,DIR. GRAL. ASUNTOS JURIDICOS,MORENO 1550 (CDAD.AUTONOMA DE BUENOS AIRES),CABA,-34.61304304879,-58.38774627,100,100,100
271,DIVISION OPERACIONES AEREAS DE AVIONES,AVIACION FEDERAL,AVIADOR MATIENZO S/N 0 (EZEIZA),BUENOS AIRES,-34.7980945482005,-58.5263136702952,100,100,100
272,COMISARIA CASA DE GOBIERNO,SEGURIDAD Y CUSTODIA,BALCARCE 50 (CDAD.AUTONOMA DE BUENOS AIRES),CABA,-34.608343295219,-58.3705425843012,100,100,100
273,DIVISION CUSTODIA PRESIDENCIAL,SEGURIDAD Y CUSTODIA,AV. DEL LIBERTADOR 2200 (OLIVOS),BUENOS AIRES,-34.513202319403,-58.4777148414729,100,100,100
274,DIVISION SEGURIDAD HONORABLE CAMARA DE DIPUTADOS DE LA NACION,SEGURIDAD Y CUSTODIA,AV. RIVADAVIA 1864 (CDAD.AUTONOMA DE BUENOS AIRES),CABA,-34.609343449901,-58.3928534624753,100,100,100
275,DIVISION SEGURIDAD Y CUSTODIA DE LOS MINISTERIOS DE SALUD Y DESARROLLO SOCIAL,SEGURIDAD Y CUSTODIA,AV. 9 DE JULIO 1925 (CDAD.AUTONOMA DE BUENOS AIRES),CABA,-34.61220717,-58.38143101,100,100,100
276,SUPER. DE AVIACION FEDERAL,AVIACION FEDERAL,BENITO CORREA 01600 (CDAD.AUTONOMA DE BUENOS AIRES),CABA,-34.62774366928,-58.35196057,100,100,100
277,DIVISION SEGURIDAD HONORABLE SENADO DE LA NACION,SEGURIDAD Y CUSTODIA,AV. RIVADAVIA 1850 (CDAD.AUTONOMA DE BUENOS AIRES),CABA,-34.609343740063,-58.3927078478824,100,100,100
279,DIVISION POLICIA ADICIONAL,ADMINISTRACION,AV. RIVADAVIA 1330 (CDAD.AUTONOMA DE BUENOS AIRES),CABA,-34.6089170292195,-58.3852958688395,100,100,100
280,DIVISION GESTION ADMINISTRATIVA-S.F.T,FEDERAL DE TRANSPORTE,SALTA 1929 (CDAD.AUTONOMA DE BUENOS AIRES),CABA,-34.6301304046294,-58.3828338785878,100,100,100
283,DIVISION SALA DE SITUACION,FEDERAL DE INTERVENCION TERRITORIAL,MORENO 1550 (CDAD.AUTONOMA DE BUENOS AIRES),CABA,-34.61290274,-58.38828008,100,100,100
289,"DIVISION SEGURIDAD Y CUSTODIA DE LOS MINISTERIOS DE ECONOMIA, TRANSPORTE Y OBRAS PUBLICAS",SEGURIDAD Y CUSTODIA,ALSINA 267 (CDAD.AUTONOMA DE BUENOS AIRES),CABA,-34.609944160736,-58.3702700734694,100,100,100
30,DIVISION CUSTODIA VICEPRESIDENCIAL Y PTE. PROVISIONAL HONOR. SENADO DE LA NACION,SEGURIDAD Y CUSTODIA,ALSINA ADOLFO 1825 (CDAD.AUTONOMA DE BUENOS AIRES),CABA,-34.611444281399,-58.3922812040816,100,100,100
300,SUPER. DROGAS PELIGROSAS,DROGAS PELIGROSAS,BELGRANO 1613 (CDAD.AUTONOMA DE BUENOS AIRES),CABA,-34.6134203683781,-58.3892664036465,100,100,100
303,DIVISION GESTION ADMINISTRATIVA - SUP.INV.FED.,INVESTIGACIONES FEDERALES,MADARIAGA 6976 (CDAD.AUTONOMA DE BUENOS AIRES),CABA,-34.6955465371332,-58.4726239585997,100,100,100
304,DIVISION ANALISIS Y PROSPECTIVA DEL NARCOTRAFICO,DROGAS PELIGROSAS,AV. BELGRANO 1613 (CDAD.AUTONOMA DE BUENOS AIRES),CABA,-34.6134021441065,-58.3890744923113,100,100,100
306,SECCION ALCALDIA - S.D.PELIGROSAS,DROGAS PELIGROSAS,AV. BELGRANO 1627 (CDAD.AUTONOMA DE BUENOS AIRES),CABA,-34.6133726815256,-58.3890781829139,100,100,100
31,DIVISION SEGURIDAD Y CUSTODIA JEFATURA DE GABINETE DE MINISTROS,SEGURIDAD Y CUSTODIA,AV. ROCA JULIO A. PRES. 782 (CDAD.AUTONOMA DE BUENOS AIRES),CABA,-34.6123920692467,-58.3768908395533,100,100,100
312,DIVISION CENTRAL RADIOELECTRICA,INVESTIGACIONES FEDERALES,MADARIAGA 6976 (CDAD.AUTONOMA DE BUENOS AIRES),CABA,-34.69588653361,-58.4717532512746,100,100,100
315,DIVISION DELITOS CONTRA EL AUTOMOTOR,INVESTIGACIONES FEDERALES,MADARIAGA 6976 (CDAD.AUTONOMA DE BUENOS AIRES),CABA,-34.6960942218744,-58.4719921027158,100,100,100
32,DIVISION SEGURIDAD Y CUSTODIA MINISTERIO DEL INTERIOR,SEGURIDAD Y CUSTODIA,25 DE MAYO 101 (CDAD.AUTONOMA DE BUENOS AIRES),CABA,-34.6064168473156,-58.3707650387492,100,100,100
321,DIVISION INDIVIDUALIZACION CRIMINAL,FEDERAL DE POLICIA CIENTIFICA,AZOPARDO 650 (CDAD.AUTONOMA DE BUENOS AIRES),CABA,-34.6153760707051,-58.3672045815772,100,100,100
325,DIR. GRAL. NARCOCRIMINALIDAD,DROGAS PELIGROSAS,AV. BELGRANO 1613 (CDAD.AUTONOMA DE BUENOS AIRES),CABA,-34.6134082188641,-58.3892811660569,100,100,100
327,DIVISION CENTRAL NACIONAL DE DATOS,DROGAS PELIGROSAS,AV. BELGRANO 1613 (CDAD.AUTONOMA DE BUENOS AIRES),CABA,-34.6134453829,-58.38919873,100,100,100
328,SECCION BRIGADAS - OP. FEDERALES,DROGAS PELIGROSAS,AV. BELGRANO 1613 (CDAD.AUTONOMA DE BUENOS AIRES),CABA,-34.6134717000549,-58.3891793054251,100,100,100
329,EX - SECCION ALCALDIA MADARIAGA,INVESTIGACIONES FEDERALES,MADARIAGA 6976 (CDAD.AUTONOMA DE BUENOS AIRES),CABA,-34.6957359839455,-58.4715916857835,100,100,100
330,SECCION JUDICIALES - OP. FEDERALES,DROGAS PELIGROSAS,AV. BELGRANO 1613 (CDAD.AUTONOMA DE BUENOS AIRES),CABA,-34.6134592468108,-58.3892951903468,100,100,100
