COD_DEP,DEPENDENCIA,SUPERINTENDENCIA,DIRECCION,PROVINCIA,LATITUD,LONGITUD,PERSONAL,MOVILES,ARMAS
1375,DIVISION UNIDAD OPERATIVA FEDERAL SAN FRANCISCO,AGENCIAS FEDERALES,PELLGRINI 491 (SAN FRANCISCO),CORDOBA,-31.434815235738,-62.0838205173187,100,100,100
1376,COORDINACION DE INSPECTORIA GENERAL,ASUNTOS INTERNOS E INSPECTORIA GENERAL,CHACABUCO 457 (CDAD.AUTONOMA DE BUENOS AIRES),CABA,-34.61335914,-58.37623962,100,100,100
1377,DIVISION JUNTA DE EVALUACION DE BENEFICIOS,BIENESTAR,SAENZ PEÑA LUIS PRES. 375 (CDAD.AUTONOMA DE BUENOS AIRES),CABA,-34.6131056953932,-58.38772410082,100,100,100
138,DEPARTAMENTO INVESTIGACIONES FEDERALES - LA PLATA,AGENCIAS FEDERALES,CALLE 49 1010 (LA PLATA),BUENOS AIRES,-34.9220246712734,-57.9587223525433,100,100,100
1382,DIVISION INTERVENCIONES JUDICIALES,INVESTIGACIONES FEDERALES,MADARIAGA 6976 (CDAD.AUTONOMA DE BUENOS AIRES),CABA,-34.6959196931844,-58.4717905028619,100,100,100
1384,DIVISION CIBERPATRULLAJE,INVESTIGACIONES FEDERALES,CAVIA 3350 (CDAD.AUTONOMA DE BUENOS AIRES),CABA,-34.57351578557,-58.40587869,100,100,100
1385,DEPTO. RELACIONES INSTITUCIONALES,PLANEAMIENTO Y DESARROLLO ESTRATEGICO,MORENO 1550 (CDAD.AUTONOMA DE BUENOS AIRES),CABA,-34.61331583022,-58.38829201,100,100,100
1386,DEPTO. PLANEAMIENTO ESTRATEGICO,PLANEAMIENTO Y DESARROLLO ESTRATEGICO,MORENO 1550 (CDAD.AUTONOMA DE BUENOS AIRES),CABA,-34.61301597924,-58.38799543,100,100,100
1387,DIVISION PLANEAMIENTO PROSPECTIVO,PLANEAMIENTO Y DESARROLLO ESTRATEGICO,MORENO 1550 (CDAD.AUTONOMA DE BUENOS AIRES),CABA,-34.61291609647,-58.38790901,100,100,100
1388,DIVISION PROYECTOS OPERATIVOS,PLANEAMIENTO Y DESARROLLO ESTRATEGICO,MORENO 1550 (CDAD.AUTONOMA DE BUENOS AIRES),CABA,-34.6133950062657,-58.3879276375534,100,100,100
139,DEPARTAMENTO INVESTIGACIONES FEDERALES - DOLORES,AGENCIAS FEDERALES,SARMIENTO 2551 (GENERAL PUEYRREDON),BUENOS AIRES,-38.011216259672,-57.5426266937963,100,100,100
1390,DIVISION SEGUIMIENTO DE GESTION,PLANEAMIENTO Y DESARROLLO ESTRATEGICO,MORENO 1550 (CDAD.AUTONOMA DE BUENOS AIRES),CABA,-34.6129610758723,-58.3887255648473,100,100,100
1392,DIVISION ANTIDROGAS SAN FRANCISCO,DROGAS PELIGROSAS,PELLGRINI 491 (SAN FRANCISCO),CORDOBA,-31.43481645258,-62.08381839,100,100,100
1393,DIVISION COORDINACION CIENTIFICO PERICIAL,FEDERAL DE POLICIA CIENTIFICA,AZOPARDO 670 (CDAD.AUTONOMA DE BUENOS AIRES),CABA,-34.6150518308419,-58.3674363345277,100,100,100
1394,SECCION ENSAYOS Y ESTANDARES PERICIALES,FEDERAL DE POLICIA CIENTIFICA,AZOPARDO 650 (CDAD.AUTONOMA DE BUENOS AIRES),CABA,-34.6151060382137,-58.3674351147754,100,100,100
1395,GABINETE CIENTIFICO-CHAJARI,FEDERAL DE POLICIA CIENTIFICA,BOLIVAR 1990 (CHAJARI),ENTRE RIOS,-30.7532129069495,-57.9876893042767,100,100,100
1396,GABINETE CIENTIFICO-SANTA ROSA,FEDERAL DE POLICIA CIENTIFICA,ARTURO ILLIA 560 (SANTA ROSA),LA PAMPA,-36.618316817691,-64.263750502149,100,100,100
1397,GABINETE CIENTIFICO-SAN LUIS,FEDERAL DE POLICIA CIENTIFICA,PEDERNERA 710 (LA CAPITAL (J.M.DE PUEYRREDON)),SAN LUIS,-33.299516955648,-66.3340407022402,100,100,100
1398,"DIVISION SEGURIDAD Y CUSTODIA MINISTERIO DE TRABAJO, EMPLEO Y SEGURIDAD SOCIAL - ANSES - U.F.I.SES.",SEGURIDAD Y CUSTODIA,PARANA 451 (CDAD.AUTONOMA DE BUENOS AIRES),CABA,-34.603417089083,-58.3878628326531,100,100,100
1399,DIVISION APOYO LOGISTICO-SUP.FED.BOMBEROS,FEDERAL DE BOMBEROS,AV. BELGRANO 1547 (CDAD.AUTONOMA DE BUENOS AIRES),CABA,-34.61339132,-58.38825644,100,100,100
14,SALA DE CRIOS.MAYORES E INSPECTORES,SUBJEFATURA,MORENO 1550 (CDAD.AUTONOMA DE BUENOS AIRES),CABA,-34.6125829589662,-58.3878473669469,100,100,100
140,DEPTO INVESTIGACIONES FEDERALES - SANTA ROSA,AGENCIAS FEDERALES,ARTURO ILLIA 560 (SANTA ROSA),LA PAMPA,-36.618317317691,-64.263750502149,100,100,100
1400,DIVISION CENTRO DE SEGURIDAD E HIGIENE LABORAL,FEDERAL DE BOMBEROS,AV. BELGRANO 1547 (CDAD.AUTONOMA DE BUENOS AIRES),CABA,-34.61336709,-58.38783531,100,100,100
1401,DEPTO. CIBERSEGURIDAD-SUP.COM,FEDERAL DE TECNOLOGIAS DE LA INFORMACION Y COMUNICACIONES,MORENO 1550 (CDAD.AUTONOMA DE BUENOS AIRES),CABA,-34.61321755558,-58.38869104,100,100,100
1402,DIVISION CUARTEL AEROPUERTO INTERNACIONAL CATAMARCA CORONEL FELIPE VARELA,FEDERAL DE BOMBEROS,RUTA PROVINCIAL 33 KM 22 (VALLE VIEJO),CATAMARCA,-28.595017649959,-65.7555285437384,100,100,100
1403,DIVISION CUARTEL AEROPUERTO INTERNACIONAL PUERTO MADRYN EL TEHUELCHE,FEDERAL DE BOMBEROS,RUTA 3 0 (BIEDMA),CHUBUT,-42.75511777837,-65.10071029,100,100,100
1404,DEPTO. CENTRO DE ESPECIALIDADES Y COORDINACION OPERATIVA,FEDERAL DE INTERVENCION TERRITORIAL,CAVIA 3302 (CDAD.AUTONOMA DE BUENOS AIRES),CABA,-34.574082476396,-58.4048771430919,100,100,100
1406,DIVISION OPERACIONES AREA METROPOLITANA NORTE,DROGAS PELIGROSAS,AV. BELGRANO 1613 (CDAD.AUTONOMA DE BUENOS AIRES),CABA,-34.6133571908861,-58.3890800282152,100,100,100
1407,DIVISION OPERACIONES AREA METROPOLITANA SUR,DROGAS PELIGROSAS,AV. BELGRANO 1613 (CDAD.AUTONOMA DE BUENOS AIRES),CABA,-34.6133420039818,-58.3891870556906,100,100,100
1408,DIVISION OPERACIONES AREA METROPOLITANA OESTE,DROGAS PELIGROSAS,AV. BELGRANO 1613 (CDAD.AUTONOMA DE BUENOS AIRES),CABA,-34.613393943183,-58.3892815351172,100,100,100
1409,DIVISION UNIDAD OPERATIVA FEDERAL QUILMES,AGENCIAS FEDERALES,CALLE 49 1010 (LA PLATA),BUENOS AIRES,-34.9220588802853,-57.9587602230838,100,100,100
1410,COORDINACION CINOTECNICA GENERAL,FEDERAL DE INTERVENCION TERRITORIAL,MORENO 1550 (CDAD.AUTONOMA DE BUENOS AIRES),CABA,-34.6126831933997,-58.3880739699465,100,100,100
1411,DEPTO. BRIGADAS DE EXPLOSIVOS,FEDERAL DE BOMBEROS,AV. BELGRANO 1547 (CDAD.AUTONOMA DE BUENOS AIRES),CABA,-34.61341036,-58.38768438,100,100,100
1412,DIVISION RIESGO QUIMICO Y BIOLOGICO,FEDERAL DE BOMBEROS,PORCEL DE PERALTA MANUEL 750 (CDAD.AUTONOMA DE BUENOS AIRES),CABA,-34.6293327295981,-58.5242209682559,100,100,100
1413,DIVISION RIESGO RADIOLOGICO Y NUCLEAR,FEDERAL DE BOMBEROS,PORCEL DE PERALTA MANUEL 750 (CDAD.AUTONOMA DE BUENOS AIRES),CABA,-34.6294129716934,-58.5242021757524,100,100,100
1416,SECCION PERROS,FEDERAL DE INTERVENCION TERRITORIAL,CAVIA 3302 (CDAD.AUTONOMA DE BUENOS AIRES),CABA,-34.57271871278,-58.40436807,100,100,100
1419,DIR. GRAL. DE OPERACIONES AEREAS,AVIACION FEDERAL,LAVAISSE BENJAMIN 1551 (CDAD.AUTONOMA DE BUENOS AIRES),CABA,-34.62761887758,-58.35199628,100,100,100
1420,DIVISION CUSTODIA DE EX MANDATARIOS,SEGURIDAD Y CUSTODIA,BALCARCE 50 (CDAD.AUTONOMA DE BUENOS AIRES),CABA,-34.608518905441,-58.3702121367907,100,100,100
1421,DEPTO. TECNOLOGICO DE VIDEO OPERATIVO,FEDERAL DE TECNOLOGIAS DE LA INFORMACION Y COMUNICACIONES,AV. BELGRANO 1549 (CDAD.AUTONOMA DE BUENOS AIRES),CABA,-34.613419064242,-58.3882061755102,100,100,100
1422,DIVISION APLICACIONES TECNICAS DE VIDEO,FEDERAL DE TECNOLOGIAS DE LA INFORMACION Y COMUNICACIONES,AV. BELGRANO 1549 (CDAD.AUTONOMA DE BUENOS AIRES),CABA,-34.613419164242,-58.3882061755102,100,100,100
1423,DIVISION PREVENCION FEDERAL DE RIESGOS,FEDERAL DE BOMBEROS,AV. BELGRANO 1547 (CDAD.AUTONOMA DE BUENOS AIRES),CABA,-34.6133846791758,-58.3884362025916,100,100,100
1424,DIVISION CANES DE BOMBEROS,FEDERAL DE BOMBEROS,BATLLE Y ORDOÑEZ JOSE PABLO TORCUATO 4520 (CDAD.AUTONOMA DE BUENOS AIRES),CABA,-34.67069355,-58.46429826,100,100,100
1425,DEPTO. AEROPUERTOS AREA INTERIOR NORTE,FEDERAL DE BOMBEROS,LAVAISSE BENJAMIN 1551 (CDAD.AUTONOMA DE BUENOS AIRES),CABA,-34.628119401744,-58.3501823335424,100,100,100
1426,DIVISION CUARTEL AEROPUERTO INTERNACIONAL MDP ASTOR PIAZZOLLA,FEDERAL DE BOMBEROS,RUTA 2 KM 398 (GENERAL PUEYRREDON),BUENOS AIRES,-37.93481957362,-57.58362897,100,100,100
1427,DIVISIONDEFENSAS Y QUERELLAS PENALES,DIR. GRAL. ASUNTOS JURIDICOS,SAENZ PEÑA LUIS PRES. 375 (CDAD.AUTONOMA DE BUENOS AIRES),CABA,-34.6131178449515,-58.3877244698803,100,100,100
1428,DIVISION PATROCINIO EN EL INTERIOR,DIR. GRAL. ASUNTOS JURIDICOS,SAENZ PEÑA LUIS PRES. 375 (CDAD.AUTONOMA DE BUENOS AIRES),CABA,-34.6131053916543,-58.3876978975416,100,100,100
1429,DIVISION ANTIDROGAS RECONQUISTA,DROGAS PELIGROSAS,9 DE JULIO 1144 (RECONQUISTA),SANTA FE,-29.148819848113,-59.6479757191903,100,100,100
1430,DEPTO. ABASTECIMIENTO,ADMINISTRACION,AV. BELGRANO 752 (CDAD.AUTONOMA DE BUENOS AIRES),CABA,-34.6129172128113,-58.3769825375844,100,100,100
1431,DIVISION CENTRO DE ENTRENAMIENTO POLICIAL,INSTRUCCION Y FORMACION ACADEMICA,CORVALAN 3968 (CDAD.AUTONOMA DE BUENOS AIRES),CABA,-34.66872002986,-58.46909393,100,100,100
1433,DIR. GRAL. DE ESCUELAS DE FORMACION POLICIAL,INSTRUCCION Y FORMACION ACADEMICA,ROSARIO 532 (CDAD.AUTONOMA DE BUENOS AIRES),CABA,-34.6196817979543,-58.4361623442399,100,100,100
1434,DIR. GRAL. DE CAPACITACION SUPERIOR,INSTRUCCION Y FORMACION ACADEMICA,ROSARIO 532 (CDAD.AUTONOMA DE BUENOS AIRES),CABA,-34.619708548439,-58.436310652646,100,100,100
1435,DIVISION GESTION ADMINISTRATIVA - SIYFA,INSTRUCCION Y FORMACION ACADEMICA,ROSARIO 532 (CDAD.AUTONOMA DE BUENOS AIRES),CABA,-34.6198021750678,-58.436306589402,100,100,100
1436,DIVISION CURSOS,INSTRUCCION Y FORMACION ACADEMICA,ROSARIO 532 (CDAD.AUTONOMA DE BUENOS AIRES),CABA,-34.6197570336707,-58.436381759416,100,100,100
1437,DEPTO. AREA MINISTERIOS DE SEGURIDAD Y JUSTICIA,SEGURIDAD Y CUSTODIA,AV. GELLY Y OBES GRAL. 2289 (CDAD.AUTONOMA DE BUENOS AIRES),CABA,-34.5857124172576,-58.3965438311395,100,100,100
1438,EX - SECCION SEGURIDAD Y CUSTODIA UNIDAD GABINETE DE ASESORES,SEGURIDAD Y CUSTODIA,BALCARCE 50 (CDAD.AUTONOMA DE BUENOS AIRES),CABA,-34.608520605441,-58.3702121367907,100,100,100
1440,DEPTO. SERVICIOS NACIONALES,FEDERAL DE TECNOLOGIAS DE LA INFORMACION Y COMUNICACIONES,AV. BELGRANO 1549 (CDAD.AUTONOMA DE BUENOS AIRES),CABA,-34.613420764242,-58.3882061755102,100,100,100
1441,DIVISION PERICIAS TELEFONICAS,FEDERAL DE TECNOLOGIAS DE LA INFORMACION Y COMUNICACIONES,AV. BELGRANO 1549 (CDAD.AUTONOMA DE BUENOS AIRES),CABA,-34.6153601,-58.36704255,100,100,100
1442,DIVISION PERICIAS INFORMATICAS Y ELECTRONICAS,FEDERAL DE TECNOLOGIAS DE LA INFORMACION Y COMUNICACIONES,AV. BELGRANO 1549 (CDAD.AUTONOMA DE BUENOS AIRES),CABA,-34.61523772,-58.36724656,100,100,100
1443,SECCION DEPOSITO JUDICIAL,FEDERAL DE TECNOLOGIAS DE LA INFORMACION Y COMUNICACIONES,AV. BELGRANO 1549 (CDAD.AUTONOMA DE BUENOS AIRES),CABA,-34.613421064242,-58.3882061755102,100,100,100
1444,DIR. GRAL. DE SEGURIDAD EN MEDIOS DE TRANSPORTE,FEDERAL DE TRANSPORTE,SALTA 1929 (CDAD.AUTONOMA DE BUENOS AIRES),CABA,-34.6300987893913,-58.3828350983402,100,100,100
1445,SECCION CANES DE SEGURIDAD EN MEDIOS DE TRANSPORTE,FEDERAL DE TRANSPORTE,HORNOS GRAL. 41 (CDAD.AUTONOMA DE BUENOS AIRES),CABA,-34.6282849076567,-58.3806605848001,100,100,100
1446,SECCION SEGURIDAD DROGAS PELIGROSAS,DROGAS PELIGROSAS,AV. BELGRANO 1613 (CDAD.AUTONOMA DE BUENOS AIRES),CABA,-34.613345345101,-58.3891331728926,100,100,100
1447,SECCION SEGURIDAD Y ENLACE SEDRONAR,DROGAS PELIGROSAS,AV. BELGRANO 1613 (CDAD.AUTONOMA DE BUENOS AIRES),CABA,-34.6133608357427,-58.389277106394,100,100,100
1448,DEPARTAMENTO CONTROL ESTRATEGICO,FEDERAL DE INTERVENCION TERRITORIAL,YRIGOYEN HIPOLITO 4848 (FLORIDA OESTE),BUENOS AIRES,-34.5410966485949,-58.525903499508,100,100,100
1449,DIVISION UNIDAD DE DESPLIEGUE ESTRATEGICO,FEDERAL DE INTERVENCION TERRITORIAL,YRIGOYEN HIPOLITO 4848 (FLORIDA OESTE),BUENOS AIRES,-34.5410813156002,-58.5258617777261,100,100,100
1450,DIVISION UNIDAD DE DESPLIEGUE MOVIL,FEDERAL DE INTERVENCION TERRITORIAL,YRIGOYEN HIPOLITO 4848 (FLORIDA OESTE),BUENOS AIRES,-34.5410480059812,-58.5257809016567,100,100,100
1451,DEPARTAMENTO CUERPO POLICIA DE PREVENCION BARRIAL,FEDERAL DE INTERVENCION TERRITORIAL,CAVIA 3370 (CDAD.AUTONOMA DE BUENOS AIRES),CABA,-34.5737824131156,-58.404182836273,100,100,100
1452,DIVISION OPERACIONES - SFIT,FEDERAL DE INTERVENCION TERRITORIAL,YRIGOYEN HIPOLITO 4848 (FLORIDA OESTE),BUENOS AIRES,-34.5410871315641,-58.5257963066223,100,100,100
1453,DIVISION DOCTRINA Y REENTRENAMIENTO,FEDERAL DE INTERVENCION TERRITORIAL,CAVIA 3370 (CDAD.AUTONOMA DE BUENOS AIRES),CABA,-34.5738066691423,-58.4042940675776,100,100,100
1454,SECCION BARRIAL I,FEDERAL DE INTERVENCION TERRITORIAL,YRIGOYEN HIPOLITO 4848 (FLORIDA OESTE),BUENOS AIRES,-34.5411066943486,-58.5258450890134,100,100,100
1455,SECCION BARRIAL II,FEDERAL DE INTERVENCION TERRITORIAL,YRIGOYEN HIPOLITO 4848 (FLORIDA OESTE),BUENOS AIRES,-34.5411394752205,-58.5259381606806,100,100,100
1456,DIVISION SERVICIOS METROPOLITANOS Y AMBA,FEDERAL DE INTERVENCION TERRITORIAL,YRIGOYEN HIPOLITO 4848 (FLORIDA OESTE),BUENOS AIRES,-34.5411590379927,-58.5259901524395,100,100,100
1457,DIVISION SERVICIOS FEDERALES,FEDERAL DE INTERVENCION TERRITORIAL,YRIGOYEN HIPOLITO 4848 (FLORIDA OESTE),BUENOS AIRES,-34.5410633389821,-58.5258219815649,100,100,100
1459,GABINETE CIENTIFICO-USHUAIA,FEDERAL DE POLICIA CIENTIFICA,GOBERNADOR ERNESTO MANUEL CAMPOS 1562 (USHUAIA),TIERRA DEL FUEGO,-54.808022525313,-68.3217427168731,100,100,100
146,DEPTO. INVESTIGACIONES FEDERALES - TUCUMAN,AGENCIAS FEDERALES,SANTA FE 630 (SAN MIGUEL DE TUCUMAN),TUCUMAN,-26.8197226924,-65.2040493714286,100,100,100
1460,DEPARTAMENTO CONTROL DE LINEAS II,FEDERAL DE TRANSPORTE,SALTA 1929 (CDAD.AUTONOMA DE BUENOS AIRES),CABA,-34.6300837345117,-58.3828350983402,100,100,100
1461,DIVISION INTERIOR Y CARGAS,FEDERAL DE TRANSPORTE,SALTA 1929 (CDAD.AUTONOMA DE BUENOS AIRES),CABA,-34.6300681778,-58.3828357082164,100,100,100
1462,"SECCION SEGURIDAD Y CUSTODIA MINISTERIO DE LAS MUJERES, GENEROS Y DIVERSIDAD",SEGURIDAD Y CUSTODIA,AV. PASEO COLON 275 (CDAD.AUTONOMA DE BUENOS AIRES),CABA,-34.610822956283,-58.3698052056212,100,100,100
1463,SECCION DILIGENCIAS JUDICIALES,SEGURIDAD Y CUSTODIA,TALCAHUANO 550 (CDAD.AUTONOMA DE BUENOS AIRES),CABA,-34.6022624762177,-58.3856615543003,100,100,100
1464,SECCION SEGURIDAD Y CUSTODIA MINISTERIO DE TURISMO Y DEPORTES,SEGURIDAD Y CUSTODIA,AV. RIVADAVIA 2269 (CDAD.AUTONOMA DE BUENOS AIRES),CABA,-34.60952312405,-58.398619642642,100,100,100
1465,DIVISION SEGURIDAD Y CUSTODIA CASA DE MONEDA,SEGURIDAD Y CUSTODIA,AV. ANTARTIDA ARGENTINA 2085 (CDAD.AUTONOMA DE BUENOS AIRES),CABA,-34.5837657646238,-58.3725239216688,100,100,100
1466,SECCION SEGURIDAD Y CUSTODIA AUDITORIA GENERAL DE LA NACION,SEGURIDAD Y CUSTODIA,PARANA 386 (CDAD.AUTONOMA DE BUENOS AIRES),CABA,-34.604423343657,-58.3878756850057,100,100,100
1467,EX -SECCION CAPACITACION - SSC,SEGURIDAD Y CUSTODIA,MORENO 1417 (CDAD.AUTONOMA DE BUENOS AIRES),CABA,-34.6120043305531,-58.3864290683678,100,100,100
1468,SECCION SEGURIDAD Y CUSTODIA AGENCIA NACIONAL DE MATERIALES CONTROLADOS (ANMAC),SEGURIDAD Y CUSTODIA,GRAL MANUEL NICOLAS SAVIO 1700 (VILLA MAIPU),BUENOS AIRES,-34.571123528624,-58.5156998351863,100,100,100
1469,SECCION ASISTENCIA SOCIAL,BIENESTAR,AV. SAENZ PEÑA ROQUE PRES. 375 (CDAD.AUTONOMA DE BUENOS AIRES),CABA,-34.6131321206801,-58.3877344345073,100,100,100
147,DEPTO. INVESTIGACIONES FEDERALES - MENDOZA,AGENCIAS FEDERALES,SAN JUAN (3 DE FEBRERO) 325 (MENDOZA),MENDOZA,-32.900123752089,-68.8399709022506,100,100,100
1470,DIVISION ABORDAJE INTEGRAL A LAS PERSONAS CON DISCAPACIDAD,BIENESTAR,AV. SAENZ PEÑA ROQUE PRES. 375 (CDAD.AUTONOMA DE BUENOS AIRES),CABA,-34.6131442702345,-58.3877344345073,100,100,100
1471,DIVISION RECEPCION Y ANALISIS DE LAS COMUNICACIONES,FEDERAL DE TECNOLOGIAS DE LA INFORMACION Y COMUNICACIONES,AV. BELGRANO 1549 (CDAD.AUTONOMA DE BUENOS AIRES),CABA,-34.613423964242,-58.3882061755102,100,100,100
1472,"UNIDAD DE AUDITORIA GENERAL, PROCESOS Y CONTROL DE GESTION",BIENESTAR,AV. INDEPENDENCIA 353 (CDAD.AUTONOMA DE BUENOS AIRES),CABA,-34.6170352254122,-58.3708497430829,100,100,100
1473,DIRECCION GENERAL EXPLOSIVOS Y RIESGOS ESPECIALES,FEDERAL DE BOMBEROS,AV. BELGRANO 1547 (CDAD.AUTONOMA DE BUENOS AIRES),CABA,-34.6133670623724,-58.3883099839827,100,100,100
1474,DIVISION INVESTIGACIONES,FEDERAL DE BOMBEROS,AV. BELGRANO 1547 (CDAD.AUTONOMA DE BUENOS AIRES),CABA,-34.61338168,-58.38768999,100,100,100
1475,DIVISION BUSQUEDA Y DETECCION,FEDERAL DE BOMBEROS,BATLLE Y ORDOÑEZ JOSE PABLO TORCUATO 4520 (CDAD.AUTONOMA DE BUENOS AIRES),CABA,-34.67093187,-58.46445258,100,100,100
1476,DEPARTAMENTO TECNICO INVESTIGATIVO,FEDERAL DE BOMBEROS,AV. BELGRANO 1547 (CDAD.AUTONOMA DE BUENOS AIRES),CABA,-34.61333955,-58.38794929,100,100,100
1477,DIVISION ANALISIS DE INFORMACION SINIESTRAL,FEDERAL DE BOMBEROS,AV. BELGRANO 1547 (CDAD.AUTONOMA DE BUENOS AIRES),CABA,-34.6133943987898,-58.3882922690902,100,100,100
1478,DEPARTAMENTO COORDINACION Y ENLACE CON EL SINAGIR,FEDERAL DE BOMBEROS,AV. BELGRANO 1547 (CDAD.AUTONOMA DE BUENOS AIRES),CABA,-34.61342154,-58.38839533,100,100,100
1479,DIVISION ANALISIS DE LA INFORMACION,DIR. GRAL. GABINETE DE JEFATURA,MORENO 1550 (CDAD.AUTONOMA DE BUENOS AIRES),CABA,-34.6127755304676,-58.3886253459749,100,100,100
148,DEPARTAMENTO INVESTIGACIONES FEDERALES-CORRIENTES,AGENCIAS FEDERALES,PLACIDO MARTINEZ 750 (CAPITAL),CORRIENTES,-27.46162481932,-58.84073789,100,100,100
1480,SECCION APOYO TECNICO,DIR. GRAL. GABINETE DE JEFATURA,MORENO 1550 (CDAD.AUTONOMA DE BUENOS AIRES),CABA,-34.6126564642293,-58.388609845444,100,100,100
1481,SECCION RELACIONES PUBLICAS,DIR. GRAL. GABINETE DE JEFATURA,MORENO 1550 (CDAD.AUTONOMA DE BUENOS AIRES),CABA,-34.612658286673,-58.3886703713266,100,100,100
1482,DIRECCION GENERAL DE COORDINACION INVESTIGATIVA JUDICIAL,ASUNTOS INTERNOS E INSPECTORIA GENERAL,AV. RIVADAVIA 1325 (CDAD.AUTONOMA DE BUENOS AIRES),CABA,-34.608553130767,-58.3852988213216,100,100,100
1483,DEPARTAMENTO INVESTIGACIONES FEDERALES INTERIOR,ASUNTOS INTERNOS E INSPECTORIA GENERAL,AV. RIVADAVIA 1325 (CDAD.AUTONOMA DE BUENOS AIRES),CABA,-34.6085750011698,-58.3852980832011,100,100,100
1484,DEP. UNIDADES TACTICAS DE INTERVENCION FEDERAL,FEDERAL DE INTERVENCION TERRITORIAL,AV. 9 DE JULIO 233 (ROSARIO),SANTA FE,-32.9561576184167,-60.6280801338408,100,100,100
1485,DIVISION UNIDAD TACTICA DE INTERVENCION FEDERAL CUYO,FEDERAL DE INTERVENCION TERRITORIAL,AV. RIVADAVIA 44 (CAPITAL),SAN JUAN,-31.536625458417,-68.5253560205081,100,100,100
1486,DIVISION UNIDAD TACTICA INTERVENCION FEDERAL TUCUMAN,FEDERAL DE INTERVENCION TERRITORIAL,LAPRIDA 1074 (SAN MIGUEL DE TUCUMAN),TUCUMAN,-26.81697033,-65.20081425,100,100,100
1487,DIVISION UNIDAD TACTICA DE INTERVENCION FEDERAL MAR DEL PLATA BS AS SUR,FEDERAL DE INTERVENCION TERRITORIAL,ESCOLLERA NORTE S/N (GENERAL PUEYRREDON),BUENOS AIRES,-38.035125646249,-57.5264075566957,100,100,100
1488,DIVISION UNIDAD TACTICA DE INTERVENCION FEDERAL CORDOBA,FEDERAL DE INTERVENCION TERRITORIAL,CAVIA 3380 (CDAD.AUTONOMA DE BUENOS AIRES),CABA,-34.5739166575882,-58.4043926012446,100,100,100
1489,DIVISION UNIDAD TACTICA DE INTERVENCION FEDERAL SANTA FE,FEDERAL DE INTERVENCION TERRITORIAL,AV. 9 DE JULIO 233 (ROSARIO),SANTA FE,-32.9561294842639,-60.6280374599648,100,100,100
149,DEPTO. INVESTIGACIONES FEDERALES - COMODORO RIVADAVIA,AGENCIAS FEDERALES,AV. RIVADAVIA 1183,CHUBUT,-45.8620139139664,-67.4919659026598,100,100,100
1490,DIVISION UNIDAD TACTICA DE INTERVENCION FEDERAL PATAGONIA-NEUQUEN,FEDERAL DE INTERVENCION TERRITORIAL,CAVIA 3380 (CDAD.AUTONOMA DE BUENOS AIRES),CABA,-34.5737815767008,-58.4042722276411,100,100,100
1491,DIVISION UNIDAD TACTICA DE INTERVENCION FEDERAL PATAGONIA COMODORO RIVADAVIA,FEDERAL DE INTERVENCION TERRITORIAL,CAVIA 3380 (CDAD.AUTONOMA DE BUENOS AIRES),CABA,-34.5737564842517,-58.4042493718936,100,100,100
1492,DIVISION UNIDAD TACTICA DE INTERVENCION FEDERAL NEA CORRIENTES,FEDERAL DE INTERVENCION TERRITORIAL,PLACIDO MARTINEZ 750 (CAPITAL),CORRIENTES,-27.46162621932,-58.84073789,100,100,100
1493,DIVISION SEGURIDAD,INVESTIGACIONES FEDERALES,MADARIAGA 6976 (CDAD.AUTONOMA DE BUENOS AIRES),CABA,-34.6954785754958,-58.4729105732041,100,100,100
1494,DIR. GRAL. DE CIBERCRIMEN,INVESTIGACIONES FEDERALES,CAVIA 3380 (CDAD.AUTONOMA DE BUENOS AIRES),CABA,-34.57362646435,-58.40573838,100,100,100
1495,DEPTO. INVESTIGACIONES ANTIMAFIA,INVESTIGACIONES FEDERALES,MORENO 1417 (CDAD.AUTONOMA DE BUENOS AIRES),CABA,-34.6120243775892,-58.386507309143,100,100,100
1496,DEPARTAMENTO INVESTIGACION CIENTIFICA FEDERAL,FEDERAL DE POLICIA CIENTIFICA,AZOPARDO 670 (CDAD.AUTONOMA DE BUENOS AIRES),CABA,-34.6153680400117,-58.3672948432527,100,100,100
1497,GABINETE CIENTIFICO-SAN JUAN,FEDERAL DE POLICIA CIENTIFICA,AV. ENTRE RIOS 466 (CAPITAL),SAN JUAN,-31.539926736249,-68.5268158790117,100,100,100
1498,GABINETE CIENTIFICO-MAR DEL PLATA,FEDERAL DE POLICIA CIENTIFICA,SARMIENTO 2551 (GENERAL PUEYRREDON),BUENOS AIRES,-38.0111268475,-57.5427112,100,100,100
1499,GABINETE CIENTIFICO-TUCUMAN,FEDERAL DE POLICIA CIENTIFICA,LAPRIDA 1074 (SAN MIGUEL DE TUCUMAN),TUCUMAN,-26.8161993,-65.20056495,100,100,100
1500,DIVISION DESPACHO GENERAL,AGENCIAS FEDERALES,MORENO 1417 (CDAD.AUTONOMA DE BUENOS AIRES),CABA,-34.6120960608908,-58.3864585931887,100,100,100
1501,SECCION SEGURIDAD,AGENCIAS FEDERALES,MORENO 1417 (CDAD.AUTONOMA DE BUENOS AIRES),CABA,-34.6122066231498,-58.3865176428303,100,100,100
1503,DIVISION ANALISIS TECNICO Y CLASIFICACION DE LA INFORMACION,AGENCIAS FEDERALES,MORENO 1417 (CDAD.AUTONOMA DE BUENOS AIRES),CABA,-34.6119885359152,-58.3865095235045,100,100,100
1504,AGENCIA REGIONAL FEDERAL BUENOS AIRES NORTE,AGENCIAS FEDERALES,MORENO 1417 (CDAD.AUTONOMA DE BUENOS AIRES),CABA,-34.6120511069631,-58.3864024960292,100,100,100
1505,DIVISION DESPACHO Y LOGÍSTICA ARFBAN,AGENCIAS FEDERALES,VENEZUELA 3143 (CDAD.AUTONOMA DE BUENOS AIRES),CABA,-34.6164482696006,-58.4101205055242,100,100,100
1506,AGENCIA REGIONAL FEDERAL LITORAL - SANTA FE,AGENCIAS FEDERALES,A. STORNI 755 (ROSARIO),SANTA FE,-32.96000504,-60.63666961,100,100,100
1507,DIVISION UNIDAD OPERATIVA FEDERAL GUALEGUAYCHU,AGENCIAS FEDERALES,SAN MARTIN 877 (GUALEGUAYCHU),ENTRE RIOS,-33.010227657892,-58.5165236164504,100,100,100
1508,DEPARTAMENTO INVESTIGACIONES FEDERALES PARANA,AGENCIAS FEDERALES,AV. BARTOLOME MITRE 232 (PARANA),ENTRE RIOS,-31.7211681262184,-60.5292360065773,100,100,100
1509,DIVISION UNIDAD OPERATIVA DE INVESTIGACIONES ESPECIALES ROSARIO,AGENCIAS FEDERALES,AV. 9 DE JULIO 233 (ROSARIO),SANTA FE,-32.9561030552031,-60.6279724331062,100,100,100
1510,DIVISION DESPACHO Y LOGISTICA - ARFSF,AGENCIAS FEDERALES,SAN MARTIN 3381 (SANTA FE),SANTA FE,-31.6370071924451,-60.7038597931725,100,100,100
1511,DIVISION ALCAIDIA - ARFSF,AGENCIAS FEDERALES,SAN MARTIN 3381 (SANTA FE),SANTA FE,-31.6370439570014,-60.7038521728375,100,100,100
1512,DIVISION UNIDAD OPERATIVA FEDERAL GENERAL PICO,AGENCIAS FEDERALES,CALLE 19 555 (GENERAL PICO),LA PAMPA,-35.664728158458,-63.7557162262498,100,100,100
1513,DEPARTAMENTO INVESTIGACIONES FEDERALES NEUQUEN,AGENCIAS FEDERALES,SANTIAGO DEL ESTERO 136 (CONFLUENCIA),NEUQUEN,-38.9535282322,-68.0652723803005,100,100,100
1514,DIVISION UNIDAD OPERATIVA DE INVESTIGACIONES ESPECIALES NEUQUEN,AGENCIAS FEDERALES,SANTIAGO DEL ESTERO 136 (CONFLUENCIA),NEUQUEN,-38.9535283322,-68.0652723803005,100,100,100
1515,DIVISION DESPACHO Y LOGISTICA - ARFPN,AGENCIAS FEDERALES,SANTIAGO DEL ESTERO 136 (CONFLUENCIA),NEUQUEN,-38.9535284322,-68.0652723803005,100,100,100
1516,DIVISION ALCAIDIA - ARFPN,AGENCIAS FEDERALES,SANTIAGO DEL ESTERO 136 (CONFLUENCIA),NEUQUEN,-38.9535285322,-68.0652723803005,100,100,100
1517,AGENCIA REGIONAL FEDERAL PATAGONIA SUR - COMODORO RIVADAVIA,AGENCIAS FEDERALES,AV. RIVADAVIA 1183,CHUBUT,-45.8620139139664,-67.4919659026598,100,100,100
1518,DIVISION JUDICIAL Y ENLACE CON LA DAJUDECO,AGENCIAS FEDERALES,AV. DE LOS INCAS 3834 (CDAD.AUTONOMA DE BUENOS AIRES),CABA,-34.57702871553,-58.46621515,100,100,100
1519,DIVISION UNIDAD OPERATIVA DE INVESTIGACIONES ESPECIALES COMODORO RIVADAVIA,AGENCIAS FEDERALES,AV. RIVADAVIA 1183,CHUBUT,-45.8620139139664,-67.4919659026598,100,100,100
152,SECCION PERSONAL ICIA,INTELIGENCIA CRIMINAL,CASEROS 915 (CDAD.AUTONOMA DE BUENOS AIRES),CABA,-34.627828991314,-58.3769079285714,100,100,100
1520,DIVISION UNIDAD OPERATIVA FEDERAL PUERTO MADRYN,AGENCIAS FEDERALES,AV. RIVADAVIA 1183,CHUBUT,-45.8620139139664,-67.4919659026598,100,100,100
1521,DEPARTAMENTO INVESTIGACIONES FEDERALES CALETA OLIVIA,AGENCIAS FEDERALES,LAVALLE 205 (CALETA OLIVIA),SANTA CRUZ,-46.443629115158,-67.5231907186677,100,100,100
1522,DIVISION DESPACHO Y LOGISTICA - ARFPS,AGENCIAS FEDERALES,AV. RIVADAVIA 1183,CHUBUT,-45.8620139139664,-67.4919659026598,100,100,100
1523,DIVISION ALCAIDIA - ARFPS,AGENCIAS FEDERALES,AV. RIVADAVIA 1183,CHUBUT,-45.8620139139664,-67.4919659026598,100,100,100
1524,DIVISION UNIDAD OPERATIVA FEDERAL TUCUMAN,AGENCIAS FEDERALES,SANTA FE 630 (SAN MIGUEL DE TUCUMAN),TUCUMAN,-26.8197294924,-65.2040493714286,100,100,100
1525,DEPARTAMENTO INVESTIGACIONES FEDERALES-POSADAS,AGENCIAS FEDERALES,AYACUCHO 2360 (POSADAS),MISIONES,-27.3718190825421,-55.8975987365597,100,100,100
1526,DIVISION UNIDAD OPERATIVA DE INVESTIGACIONES ESPECIALES - CORRIENTES,AGENCIAS FEDERALES,PLACIDO MARTINEZ 750 (CAPITAL),CORRIENTES,-27.46162961932,-58.84073789,100,100,100
1527,DIVISION DESPACHO Y LOGISTICA - ARFNC,AGENCIAS FEDERALES,Regimiento Santa Catalina,CORRIENTES,-27.51839276,-58.82458996,100,100,100
1528,DIVISION ALCALDIA - ARFNC,AGENCIAS FEDERALES,PLACIDO MARTINEZ 750 (CAPITAL),CORRIENTES,-27.46162981932,-58.84073789,100,100,100
1529,DEPARTAMENTO INVESTIGACIONES FEDERALES - CORDOBA,AGENCIAS FEDERALES,YRIGOYEN HIPOLITO 493 (CORDOBA),CORDOBA,-31.426425048827,-64.1856142217579,100,100,100
1530,DIVISION UNIDAD INVESTIGACIONES FEDERALES - CORDOBA,AGENCIAS FEDERALES,YRIGOYEN HIPOLITO 493 (CORDOBA),CORDOBA,-31.4264077087955,-64.1855806922839,100,100,100
1531,DIVISION DESPACHO Y LOGISTICA - ARFC,AGENCIAS FEDERALES,YRIGOYEN HIPOLITO 493 (CORDOBA),CORDOBA,-31.4263842997478,-64.1855867885518,100,100,100
1532,DIVISION ALCALDIA - ARFC,AGENCIAS FEDERALES,YRIGOYEN HIPOLITO 493 (CORDOBA),CORDOBA,-31.4264259158285,-64.1855700238149,100,100,100
1533,DIRECCION GENERAL DE PLANEAMIENTO Y DESARROLLO,PLANEAMIENTO Y DESARROLLO ESTRATEGICO,MORENO 1550 (CDAD.AUTONOMA DE BUENOS AIRES),CABA,-34.6126789410322,-58.3878481050674,100,100,100
1534,SECCION INTERCAMBIO,PLANEAMIENTO Y DESARROLLO ESTRATEGICO,MORENO 1550 (CDAD.AUTONOMA DE BUENOS AIRES),CABA,-34.61293041082,-58.38863845,100,100,100
